{
  "$schema": "./bootstrap-prompts.schema.json",
  "schemaVersion": 2,
  "repository": "Tairitsua/Monica",
  "skill": "monica-guide",
  "immutableRef": "{{MONICA_IMMUTABLE_REF}}",
  "catalogDigest": "{{MONICA_CATALOG_DIGEST}}",
  "distribution": {
    "skillsCli": {
      "package": "skills",
      "version": "1.5.21"
    },
    "immutableSkillUrlTemplate": "https://github.com/Tairitsua/Monica/tree/{tag}/skills/{skill}"
  },
  "hosts": {
    "codex": {
      "agentTargets": [
        "codex"
      ]
    },
    "claude-code": {
      "agentTargets": [
        "claude-code"
      ]
    },
    "generic": {
      "agentTargets": [
        "codex",
        "claude-code"
      ]
    }
  },
  "goals": {
    "application": {
      "profile": "application"
    },
    "extension": {
      "profile": "extension-author"
    }
  },
  "locales": {
    "en-US": {
      "hosts": {
        "codex": {
          "goals": {
            "application": {
              "prompt": "Install only the named monica-guide skill globally from the immutable source https://github.com/Tairitsua/Monica/tree/{{MONICA_IMMUTABLE_REF}}/skills/monica-guide with `npx --yes skills@1.5.21 add https://github.com/Tairitsua/Monica/tree/{{MONICA_IMMUTABLE_REF}}/skills/monica-guide -g -a codex -s monica-guide -y`. This global installation changes your user-level skill directory. Verify the installed skill with `npx --yes skills@1.5.21 ls -g -a codex --json`. Codex normally discovers skills live; restart only if monica-guide is still unavailable after verification. Then invoke $monica-guide and run the dry-run preview `init --release-tag {{MONICA_IMMUTABLE_REF}} --profile application --agent codex --json` for this repository. Verify that releaseCatalogDigest equals `{{MONICA_CATALOG_DIGEST}}`, then show me all actions, file diffs, warnings, blockers, and the planDigest in plain language. Do not apply the plan, change downstream repository files, or perform remote mutations until I approve that unchanged preview. If Guide-managed instructions change later, start a new agent run before development work because AGENTS.md loads per run."
            },
            "extension": {
              "prompt": "Install only the named monica-guide skill globally from the immutable source https://github.com/Tairitsua/Monica/tree/{{MONICA_IMMUTABLE_REF}}/skills/monica-guide with `npx --yes skills@1.5.21 add https://github.com/Tairitsua/Monica/tree/{{MONICA_IMMUTABLE_REF}}/skills/monica-guide -g -a codex -s monica-guide -y`. This global installation changes your user-level skill directory. Verify the installed skill with `npx --yes skills@1.5.21 ls -g -a codex --json`. Codex normally discovers skills live; restart only if monica-guide is still unavailable after verification. Then invoke $monica-guide and run the dry-run preview `init --release-tag {{MONICA_IMMUTABLE_REF}} --profile extension-author --agent codex --json` for this repository. Verify that releaseCatalogDigest equals `{{MONICA_CATALOG_DIGEST}}`, then show me all actions, file diffs, warnings, blockers, and the planDigest in plain language. If exact read-only Monica source or its resolver prerequisite is unavailable, report the blocker and never substitute another ref. Do not apply the plan, change downstream repository files, or perform remote mutations until I approve that unchanged preview. If Guide-managed instructions change later, start a new agent run before development work because AGENTS.md loads per run."
            }
          }
        },
        "claude-code": {
          "goals": {
            "application": {
              "prompt": "Install only the named monica-guide skill globally from the immutable source https://github.com/Tairitsua/Monica/tree/{{MONICA_IMMUTABLE_REF}}/skills/monica-guide with `npx --yes skills@1.5.21 add https://github.com/Tairitsua/Monica/tree/{{MONICA_IMMUTABLE_REF}}/skills/monica-guide -g -a claude-code -s monica-guide -y`. This global installation changes your user-level skill directory. Verify the installed skill with `npx --yes skills@1.5.21 ls -g -a claude-code --json`. Claude Code normally watches existing skill directories live; restart only if monica-guide is unavailable after verification or the top-level skills directory did not exist when this session began. Then invoke $monica-guide and run the dry-run preview `init --release-tag {{MONICA_IMMUTABLE_REF}} --profile application --agent claude-code --json` for this repository. Verify that releaseCatalogDigest equals `{{MONICA_CATALOG_DIGEST}}`, then show me all actions, file diffs, warnings, blockers, and the planDigest in plain language. Do not apply the plan, change downstream repository files, or perform remote mutations until I approve that unchanged preview. If Guide-managed CLAUDE.md or AGENTS.md changes later, start a new session before development work because those instructions load at session start."
            },
            "extension": {
              "prompt": "Install only the named monica-guide skill globally from the immutable source https://github.com/Tairitsua/Monica/tree/{{MONICA_IMMUTABLE_REF}}/skills/monica-guide with `npx --yes skills@1.5.21 add https://github.com/Tairitsua/Monica/tree/{{MONICA_IMMUTABLE_REF}}/skills/monica-guide -g -a claude-code -s monica-guide -y`. This global installation changes your user-level skill directory. Verify the installed skill with `npx --yes skills@1.5.21 ls -g -a claude-code --json`. Claude Code normally watches existing skill directories live; restart only if monica-guide is unavailable after verification or the top-level skills directory did not exist when this session began. Then invoke $monica-guide and run the dry-run preview `init --release-tag {{MONICA_IMMUTABLE_REF}} --profile extension-author --agent claude-code --json` for this repository. Verify that releaseCatalogDigest equals `{{MONICA_CATALOG_DIGEST}}`, then show me all actions, file diffs, warnings, blockers, and the planDigest in plain language. If exact read-only Monica source or its resolver prerequisite is unavailable, report the blocker and never substitute another ref. Do not apply the plan, change downstream repository files, or perform remote mutations until I approve that unchanged preview. If Guide-managed CLAUDE.md or AGENTS.md changes later, start a new session before development work because those instructions load at session start."
            }
          }
        },
        "generic": {
          "goals": {
            "application": {
              "prompt": "Install only the named monica-guide skill globally for Codex and Claude Code from the immutable source https://github.com/Tairitsua/Monica/tree/{{MONICA_IMMUTABLE_REF}}/skills/monica-guide with `npx --yes skills@1.5.21 add https://github.com/Tairitsua/Monica/tree/{{MONICA_IMMUTABLE_REF}}/skills/monica-guide -g -a codex -a claude-code -s monica-guide -y`. This global installation changes your user-level skill directory. Verify both installations with `npx --yes skills@1.5.21 ls -g -a codex --json` and `npx --yes skills@1.5.21 ls -g -a claude-code --json`. Restart a host only if it cannot discover monica-guide after verification. Then invoke $monica-guide and run the dry-run preview `init --release-tag {{MONICA_IMMUTABLE_REF}} --profile application --agent codex --agent claude-code --json` for this repository. Verify that releaseCatalogDigest equals `{{MONICA_CATALOG_DIGEST}}`, then show me all actions, file diffs, warnings, blockers, and the planDigest in plain language. Do not apply the plan, change downstream repository files, or perform remote mutations until I approve that unchanged preview. Start a new host session after Guide-managed instruction changes."
            },
            "extension": {
              "prompt": "Install only the named monica-guide skill globally for Codex and Claude Code from the immutable source https://github.com/Tairitsua/Monica/tree/{{MONICA_IMMUTABLE_REF}}/skills/monica-guide with `npx --yes skills@1.5.21 add https://github.com/Tairitsua/Monica/tree/{{MONICA_IMMUTABLE_REF}}/skills/monica-guide -g -a codex -a claude-code -s monica-guide -y`. This global installation changes your user-level skill directory. Verify both installations with `npx --yes skills@1.5.21 ls -g -a codex --json` and `npx --yes skills@1.5.21 ls -g -a claude-code --json`. Restart a host only if it cannot discover monica-guide after verification. Then invoke $monica-guide and run the dry-run preview `init --release-tag {{MONICA_IMMUTABLE_REF}} --profile extension-author --agent codex --agent claude-code --json` for this repository. Verify that releaseCatalogDigest equals `{{MONICA_CATALOG_DIGEST}}`, then show me all actions, file diffs, warnings, blockers, and the planDigest in plain language. If exact read-only Monica source or its resolver prerequisite is unavailable, report the blocker and never substitute another ref. Do not apply the plan, change downstream repository files, or perform remote mutations until I approve that unchanged preview. Start a new host session after Guide-managed instruction changes."
            }
          }
        }
      }
    },
    "zh-CN": {
      "hosts": {
        "codex": {
          "goals": {
            "application": {
              "prompt": "使用 `npx --yes skills@1.5.21 add https://github.com/Tairitsua/Monica/tree/{{MONICA_IMMUTABLE_REF}}/skills/monica-guide -g -a codex -s monica-guide -y`，仅从不可变来源 https://github.com/Tairitsua/Monica/tree/{{MONICA_IMMUTABLE_REF}}/skills/monica-guide 全局安装具名 monica-guide Skill。这次全局安装会更改你的用户级 Skill 目录。使用 `npx --yes skills@1.5.21 ls -g -a codex --json` 验证实际安装。Codex 通常会实时发现 Skill；只有验证后 monica-guide 仍不可用时才重启。然后调用 $monica-guide，对此仓库运行 dry-run 预览 `init --release-tag {{MONICA_IMMUTABLE_REF}} --profile application --agent codex --json`。确认 releaseCatalogDigest 等于 `{{MONICA_CATALOG_DIGEST}}`，再用清晰语言向我展示全部操作、文件差异、警告、阻塞项和 planDigest。在我批准这份未变化的预览前，不要应用计划，不要修改后续仓库文件，也不要执行远程变更。如果 Guide 后续修改了托管指令，请在开发前新开一次 agent run，因为 AGENTS.md 按 run 加载。"
            },